A1: Student Number | B1: Student | C1: In-Class Checklist (from Participator) on 12-03-2019(mid-term) | D1: mid-term Total | E1: mid-term %/Max | F1: Grade mid-term% | G1: In-Class Checklist (from Participator) on 01-28-2020(final) | H1: final Total | I1: final %/Max | J1: Grade final% | K1: Culture Building - Surface Culture Fall 2019(hw) | L1: Culture Building - Hidden Culture Fall 2019(hw) | M1: Culture Building - LifeKeys Fall 2019(hw) | N1: hw Total | O1: hw %/Max | P1: Grade hw% | Q1: Participation | R1: Group Participation | S1: participation Total | T1: participation %/Max | U1: Grade participation% | V1: Final Participation | W1: Final Group Participation | X1: final_participation Total | Y1: final_participation %/Max | Z1: Grade final_participation% | AA1: Sum Total % | AB1: Rank
A2: 123 | B2: AAA | C2: 1.00 | D2: 1.00 | E2: =1/1 -> 100.00 | F2: =½C-2¾2/1*15 -> 15.00 | G2: 1.00 | H2: =0+1+1 -> 2.00 | I2: =2/2 -> 100.00 | J2: =½C-2¾2/2*10 -> 10.00 | K2: 0 | L2: 0 | M2: 0 | N2: =0+0+0+0 -> 0 | O2: =0/24 -> 0 | P2: =½C-2¾2/24*20 -> 0.00 | Q2: 137.00 | R2: 16.00 | S2: =0+137+16 -> 153.00 | T2: =153/155 -> 98.71 | U2: =½C-2¾2/155*40 -> 39.48 | V2: 10.00 | W2: 4.00 | X2: =0+10+4 -> 14.00 | Y2: =14/10 -> 140.00 | Z2: =½C-2¾2/10*5 -> 7.00 | AA2: =0+½CArt_1_6¾2+½CArt_1_10¾2+½CArt_1_16¾2+½CArt_1_21¾2+½CArt_1_26¾2 -> 71.48 | AB2: =RANK($½C-1¾2, $½C-1¾$2:$½C-1¾$37) -> 9
A3: 124 | B3: BBB | C3: 1.00 | D3: 1.00 | E3: =1/1 -> 100.00 | F3: =½C-2¾3/1*15 -> 15.00 | G3: 1.00 | H3: =0+1+1 -> 2.00 | I3: =2/2 -> 100.00 | J3: =½C-2¾3/2*10 -> 10.00 | K3: 0 | L3: 0 | M3: 0 | N3: =0+0+0+0 -> 0 | O3: =0/24 -> 0 | P3: =½C-2¾3/24*20 -> 0.00 | Q3: 238.00 | R3: 16.00 | S3: =0+238+16 -> 254.00 | T3: =254/155 -> 163.87 | U3: =½C-2¾3/155*40 -> 65.55 | V3: 12.00 | W3: 4.00 | X3: =0+12+4 -> 16.00 | Y3: =16/10 -> 160.00 | Z3: =½C-2¾3/10*5 -> 8.00 | AA3: =0+½CArt_2_6¾3+½CArt_2_10¾3+½CArt_2_16¾3+½CArt_2_21¾3+½CArt_2_26¾3 -> 98.55 | AB3: =RANK($½C-1¾3, $½C-1¾$2:$½C-1¾$37) -> 1
A4: 125 | B4: CCC | C4: 1.00 | D4: 1.00 | E4: =1/1 -> 100.00 | F4: =½C-2¾5/1*15 -> 15.00 | G4: 1.00 | H4: =0+1+1 -> 2.00 | I4: =2/2 -> 100.00 | J4: =½C-2¾5/2*10 -> 10.00 | K4: 0 | L4: 0 | M4: 0 | N4: =0+0+0+0 -> 0 | O4: =0/23 -> 0 | P4: =½C-2¾5/23*20 -> 0.00 | Q4: 121.00 | R4: 3.00 | S4: =0+121+3 -> 124.00 | T4: =124/155 -> 80.00 | U4: =½C-2¾5/155*40 -> 32.00 | V4: 3.00 | W4: 2.00 | X4: =0+3+2 -> 5.00 | Y4: =5/10 -> 50.00 | Z4: =½C-2¾5/10*5 -> 2.50 | AA4: =0+½CArt_4_6¾5+½CArt_4_10¾5+½CArt_4_16¾5+½CArt_4_21¾5+½CArt_4_26¾5 -> 59.50 | AB4: =RANK($½C-1¾5, $½C-1¾$2:$½C-1¾$37) -> 27
A5: 126 | B5: DDD | C5: 1.00 | D5: 1.00 | E5: =1/1 -> 100.00 | F5: =½C-2¾6/1*15 -> 15.00 | G5: 1.00 | H5: =0+1+1 -> 2.00 | I5: =2/2 -> 100.00 | J5: =½C-2¾6/2*10 -> 10.00 | K5: 0 | L5: 0 | M5: 0 | N5: =0+0+0+0 -> 0 | O5: =0/24 -> 0 | P5: =½C-2¾6/24*20 -> 0.00 | Q5: 102.00 | R5: 16.00 | S5: =0+102+16 -> 118.00 | T5: =118/155 -> 76.13 | U5: =½C-2¾6/155*40 -> 30.45 | V5: 3.00 | W5: 4.00 | X5: =0+3+4 -> 7.00 | Y5: =7/10 -> 70.00 | Z5: =½C-2¾6/10*5 -> 3.50 | AA5: =0+½CArt_5_6¾6+½CArt_5_10¾6+½CArt_5_16¾6+½CArt_5_21¾6+½CArt_5_26¾6 -> 58.95 | AB5: =RANK($½C-1¾6, $½C-1¾$2:$½C-1¾$37) -> 28
A6: Rows: 36 | B6: N/A | C6: Ave:0.94Max:1.00Min:0.00 | D6: Ave:0.94Max:1.00Min:0.00 | E6: Ave:94.44Max:100.00Min:0.00 | F6: Ave:14.17Max:15.00Min:0.00 | G6: Ave:0.96Max:1.00Min:0.00 | H6: Ave:1.93Max:2.00Min:0.00 | I6: Ave:96.39Max:100.00Min:0.00 | J6: Ave:9.64Max:10.00Min:0.00 | K6: Ave:0.00Max:0.00Min:0.00 | L6: Ave:0.00Max:0.00Min:0.00 | M6: Ave:0.00Max:0.00Min:0.00 | N6: Ave:0.00Max:0.00Min:0.00 | O6: Ave:0.00Max:0.00Min:0.00 | P6: Ave:0.00Max:0.00Min:0.00 | Q6: Ave:139.47Max:238.00Min:0.00 | R6: Ave:12.31Max:18.00Min:0.00 | S6: Ave:151.78Max:254.00Min:0.00 | T6: Ave:97.92Max:163.87Min:0.00 | U6: Ave:39.17Max:65.55Min:0.00 | V6: Ave:2.86Max:12.00Min:-3.00 | W6: Ave:2.94Max:4.00Min:0.00 | X6: Ave:5.81Max:16.00Min:-1.00 | Y6: Ave:58.06Max:160.00Min:-10.00 | Z6: Ave:2.90Max:8.00Min:-0.50 | AA6: Ave:65.88Max:98.55Min:0.00 | AB6: N/A